<?xml version="1.0" encoding="UTF-8" standalone="yes"?>
<Knowledge-Base xmlns:xsi="http://www.w3.org/2001/XMLSchema-instance"
    xsi:noNamespaceSchemaLocation="TAK.V5.xsd">

    <RawNominalConcept id="99993" name="GDM [raw]"
        description="GDM" type="RawNominal">
        <LocalPersistence goodBefore="0" goodAfter="0" timeUnit="Seconds"/>
        <TemporalSemanticProperties concenatable="false" downwardHereditary="false"
            upwardHereditary="false" forward="false" backward="false" solid="false" gestalt="false"/>
        <Synonyms/>
        <StandardTerms>
            <StandardTerm vocabulary="UMLS" key="Gestional Diabetes" CUI="C0085207"/>
        </StandardTerms>
        <NominalAllowedValues>
            <NominalStringValue value="true"/>
            <NominalStringValue value="false"/>
        </NominalAllowedValues>
    </RawNominalConcept>
    
    <ValueAbstractionConcept id="99992" name="GDM"
        description="GDM" type="ValueAbstraction">
        <LocalPersistence goodBefore="0" goodAfter="0" timeUnit="Seconds"/>
        <TemporalSemanticProperties concenatable="false" downwardHereditary="false"
            upwardHereditary="false" forward="false" backward="false" solid="false" gestalt="false"/>
        <Synonyms/>
        <StandardTerms/>
        <NecessaryContext/>
        <DerivedFrom>
            <ConceptID_Name ConceptID="99993" ConceptName="GDM [raw]"/>
        </DerivedFrom>
        <DerivedFromComponents>
            <DerivedFromComponent>
                <ConceptID_Name ConceptID="99993" ConceptName="GDM [raw]"/>
                <componentValueConstraints value="true" Operator="Equals"/>
            </DerivedFromComponent>
        </DerivedFromComponents>
    </ValueAbstractionConcept>
    
    

    <ValueAbstractionConcept id="99999" name="Women with GDM" description="Women with GDM"
        type="ValueAbstraction">
        <LocalPersistence goodBefore="0" goodAfter="0" timeUnit="Seconds"/>
        <TemporalSemanticProperties concenatable="false" downwardHereditary="false"
            upwardHereditary="false" forward="false" backward="false" solid="false" gestalt="false"/>
        <Synonyms/>
        <StandardTerms/>
        <NecessaryContext/>
        <DerivedFrom>
            <ConceptID_Name ConceptID="100000" ConceptName="Woman with GDM [Logic]"/>
        </DerivedFrom>
        <DerivedFromComponents>
            <DerivedFromComponent>
                <ConceptID_Name ConceptID="100000" ConceptName="Woman with GDM [Logic]"/>
                <componentValueConstraints value="true" Operator="Equals"/>
            </DerivedFromComponent>
        </DerivedFromComponents>
    </ValueAbstractionConcept>


    <LogicAbstractionConcept ComponentsRelation="AND" K="0" id="100000"
        name="Woman with GDM [Logic]" description="Woman with GDM [Logic]" type="LogicAbstraction">
        <LocalPersistence goodBefore="0" goodAfter="0" timeUnit="Seconds"/>
        <TemporalSemanticProperties concenatable="false" downwardHereditary="false"
            upwardHereditary="false" forward="false" backward="false" solid="false" gestalt="false"/>
        <Synonyms/>
        <StandardTerms/>
        <NecessaryContext/>
        <DerivedFrom>
            <ConceptID_Name ConceptID="100002"/>
            <!-- woman -->
            <ConceptID_Name ConceptID="99992"/>
            <!-- GDM -->
        </DerivedFrom>
    </LogicAbstractionConcept>


    <RawNominalConcept id="100001" name="sex" description="sex" type="RawNominal">
        <LocalPersistence goodBefore="0" goodAfter="0" timeUnit="Seconds"/>
        <TemporalSemanticProperties concenatable="false" downwardHereditary="false"
            upwardHereditary="false" forward="false" backward="false" solid="false" gestalt="false"/>
        <Synonyms/>
        <StandardTerms>
            <StandardTerm vocabulary="UMLS" key="sex" CUI="C1522384"/>
        </StandardTerms>
        <NominalAllowedValues>
            <NominalStringValue value="female"/>
            <NominalStringValue value="male"/>
        </NominalAllowedValues>
    </RawNominalConcept>

    <ValueAbstractionConcept id="100002" name="woman" description="woman" type="ValueAbstraction">
        <LocalPersistence goodBefore="0" goodAfter="0" timeUnit="Seconds"/>
        <TemporalSemanticProperties concenatable="false" downwardHereditary="false"
            upwardHereditary="false" forward="false" backward="false" solid="false" gestalt="false"/>
        <StandardTerms>
            <StandardTerm vocabulary="UMLS" key="woman" CUI="C0043210"/>
        </StandardTerms>
        <NecessaryContext/>
        <DerivedFrom>
            <ConceptID_Name ConceptID="100001" ConceptName="sex"/>
        </DerivedFrom>
        <DerivedFromComponents>
            <DerivedFromComponent>
                <ConceptID_Name ConceptID="100001" ConceptName="sex"/>
                <componentValueConstraints value="female" Operator="Equals"/>
            </DerivedFromComponent>
        </DerivedFromComponents>
    </ValueAbstractionConcept>


    <RawNominalConcept id="100004" name="pregnancy" description="pregnancy" type="RawNominal">
        <LocalPersistence goodBefore="0" goodAfter="0" timeUnit="Seconds"/>
        <TemporalSemanticProperties concenatable="false" downwardHereditary="false"
            upwardHereditary="false" forward="false" backward="false" solid="false" gestalt="false"/>
        <Synonyms/>
        <StandardTerms>
            <StandardTerm vocabulary="UMLS" key="pregnancy" CUI="C0032961"/>
        </StandardTerms>
        <NominalAllowedValues>
            <NominalStringValue value="true"/>
            <NominalStringValue value="false"/>
        </NominalAllowedValues>
    </RawNominalConcept>

    <!-- all pregnant woman -->

    <ContextConcept id="100005" name="pregnant woman" description="pregnant woman" type="Context">
        <LocalPersistence goodBefore="0" goodAfter="0" timeUnit="Seconds"/>
        <TemporalSemanticProperties concenatable="false" downwardHereditary="false"
            upwardHereditary="false" forward="false" backward="false" solid="false" gestalt="false"/>
        <Synonyms/>
        <StandardTerms/>
        <DerivedFrom>
            <ConceptID_Name ConceptID="100002" ConceptName="woman"/>
        </DerivedFrom>
        <GeneratedFrom timeUnit="Seconds" timeGap="0" boundaryPoint="Start">
            <ConceptID_Name ConceptID="100004" ConceptName="pregnancy"/>
            <componentValueConstraints value="true" Operator="Equals"/>
        </GeneratedFrom>
        <GeneratedUntil timeUnit="Seconds" timeGap="0" boundaryPoint="End">
            <ConceptID_Name ConceptID="100004" ConceptName="pregnancy"/>
            <componentValueConstraints value="true" Operator="Equals"/>
        </GeneratedUntil>
    </ContextConcept>



    <!-- for women at high risk for GDM who are unable to take an oral glucose load-->
    <!-- high risk for GDM true/false-->
    <RawNominalConcept id="100007" name="high risk for GDM" description="high risk for GDM"
        type="RawNominal">
        <LocalPersistence goodBefore="0" goodAfter="0" timeUnit="Seconds"/>
        <TemporalSemanticProperties concenatable="false" downwardHereditary="false"
            upwardHereditary="false" forward="false" backward="false" solid="false" gestalt="false"/>
        <Synonyms/>
        <StandardTerms>
            <StandardTerm vocabulary="UMLS" key="?" CUI="?"/>
        </StandardTerms>
        <NominalAllowedValues>
            <NominalStringValue value="true"/>
            <NominalStringValue value="false"/>
        </NominalAllowedValues>
    </RawNominalConcept>

    <ValueAbstractionConcept id="100008" name="woman with high risk for GDM"
        description="woman with high risk for GDM" type="ValueAbstraction">
        <LocalPersistence goodBefore="0" goodAfter="0" timeUnit="Seconds"/>
        <TemporalSemanticProperties concenatable="false" downwardHereditary="false"
            upwardHereditary="false" forward="false" backward="false" solid="false" gestalt="false"/>
        <StandardTerms>
            <StandardTerm vocabulary="UMLS" key="woman with high risk for GDM" CUI="?"/>
        </StandardTerms>
        <NecessaryContext/>
        <DerivedFrom>
            <ConceptID_Name ConceptID="99998" ConceptName="woman with high risk for GDM [Logic]"/>
        </DerivedFrom>
        <DerivedFromComponents>
            <DerivedFromComponent>
                <ConceptID_Name ConceptID="99998" ConceptName="woman with high risk for GDM [Logic]"/>
                <componentValueConstraints value="true" Operator="Equals"/>
            </DerivedFromComponent>
        </DerivedFromComponents>
    </ValueAbstractionConcept>

    <LogicAbstractionConcept ComponentsRelation="AND" K="0" id="99998"
        name="woman with high risk for GDM [Logic]"
        description="woman with high risk for GDM [Logic]" type="LogicAbstraction">
        <LocalPersistence goodBefore="0" goodAfter="0" timeUnit="Seconds"/>
        <TemporalSemanticProperties concenatable="false" downwardHereditary="false"
            upwardHereditary="false" forward="false" backward="false" solid="false" gestalt="false"/>
        <Synonyms/>
        <StandardTerms/>
        <NecessaryContext/>
        <DerivedFrom>
            <ConceptID_Name ConceptID="100007"/>
            <!-- high risk for GDM -->
            <ConceptID_Name ConceptID="100002"/>
            <!-- woman -->
        </DerivedFrom>
    </LogicAbstractionConcept>



    <RawNominalConcept id="100009" name="unable to take an oral glucose load"
        description="unable to take an oral glucose load" type="RawNominal">
        <LocalPersistence goodBefore="0" goodAfter="0" timeUnit="Seconds"/>
        <TemporalSemanticProperties concenatable="false" downwardHereditary="false"
            upwardHereditary="false" forward="false" backward="false" solid="false" gestalt="false"/>
        <Synonyms/>
        <StandardTerms>
            <StandardTerm vocabulary="UMLS" key="?" CUI="?"/>